name,ring,quadrant,isNew,description
Composer,adopt,tools,TRUE,"Although the idea of dependency management ..."
Canary builds,trial,techniques,FALSE,"Many projects have external code dependencies ..."
Apache Kylin,assess,platforms,TRUE,"Apache Kylin is an open source analytics solution ..."
Torq,assess,platforms,TRUE,"Torq is the go framework"
Go,adopt,languages & frameworks,TRUE,"<b>test the bitch</b>"
Java,adopt,languages & frameworks,FALSE,"We continue to see teams run into trouble using JSF ..."
Python,adopt,languages & frameworks,FALSE,"We continue to see teams run into trouble using JSF ..."
RUST,hold,languages & frameworks,FALSE,"We continue to see teams run into trouble using JSF ..."
